{
  "actions": [],
  "artifacts": [
    {
      "content_identity": "sha256:1a3eebf3701bf2aa4d26a487bb1fa80a41cb0884a78658930e46dd5d1a051b74",
      "evidence_ids": [
        "evidence:93ca95f9e9a0c56a139a"
      ],
      "id": "artifact:62d0a0ae93133a7aad1a",
      "inspected_at": "<volatile-time>",
      "inspection_origin": "fresh",
      "locator": "app.txt",
      "media_type": "text/plain",
      "path_kind": "file",
      "reason": "bytes hashed; semantic behavior not analyzed",
      "redaction_count": 0,
      "redaction_state": "none",
      "size_bytes": 16,
      "status": "content_read",
      "type": "file"
    }
  ],
  "baseline": {
    "fresh_evidence_count": 1,
    "mode": "auto",
    "rejected_reuse_count": 0,
    "rejected_reuse_reasons": {},
    "reuse_enabled": true,
    "reused_evidence_count": 0,
    "snapshot_relation": "none",
    "source_schema_version": null,
    "source_snapshot_digest": null,
    "source_state_digest": null,
    "status": "not_found"
  },
  "checks": [
    {
      "artifact_ids": [],
      "category": "purpose_and_scope",
      "evidence_ids": [],
      "id": "check-purpose_and_scope",
      "limitations": "Requires an authorized semantic or runtime assessment appropriate to this category",
      "method": "Not performed by deterministic Scan Core state construction",
      "next_step": "Perform this check using an authorized analyzer and attach evidence",
      "reason": "Deterministic Scan Core does not perform this semantic or runtime assessment",
      "related_ids": [],
      "result": "No assessment result is available",
      "scope": "Declared local project scope",
      "status": "not_assessed",
      "title": "purpose and scope",
      "verification_state": "unverified"
    },
    {
      "artifact_ids": [
        "artifact:62d0a0ae93133a7aad1a"
      ],
      "category": "inventory_and_provenance",
      "evidence_ids": [
        "evidence:93ca95f9e9a0c56a139a"
      ],
      "id": "check-inventory_and_provenance",
      "limitations": "This check does not establish semantic correctness or runtime behavior",
      "method": "Deterministic Scan Core inventory and snapshot construction",
      "next_step": null,
      "reason": "Scan Core performs deterministic inventory as part of the local baseline",
      "related_ids": [],
      "result": "Inventory and content identities were established within configured limits",
      "scope": "Declared local project scope",
      "status": "assessed",
      "title": "Inventory and provenance",
      "verification_state": "static"
    },
    {
      "artifact_ids": [],
      "category": "architecture_and_flows",
      "evidence_ids": [],
      "id": "check-architecture_and_flows",
      "limitations": "Requires an authorized semantic or runtime assessment appropriate to this category",
      "method": "Not performed by deterministic Scan Core state construction",
      "next_step": "Perform this check using an authorized analyzer and attach evidence",
      "reason": "Deterministic Scan Core does not perform this semantic or runtime assessment",
      "related_ids": [],
      "result": "No assessment result is available",
      "scope": "Declared local project scope",
      "status": "not_assessed",
      "title": "architecture and flows",
      "verification_state": "unverified"
    },
    {
      "artifact_ids": [],
      "category": "correctness_and_integrity",
      "evidence_ids": [],
      "id": "check-correctness_and_integrity",
      "limitations": "Requires an authorized semantic or runtime assessment appropriate to this category",
      "method": "Not performed by deterministic Scan Core state construction",
      "next_step": "Perform this check using an authorized analyzer and attach evidence",
      "reason": "Deterministic Scan Core does not perform this semantic or runtime assessment",
      "related_ids": [],
      "result": "No assessment result is available",
      "scope": "Declared local project scope",
      "status": "not_assessed",
      "title": "correctness and integrity",
      "verification_state": "unverified"
    },
    {
      "artifact_ids": [],
      "category": "security_and_trust",
      "evidence_ids": [],
      "id": "check-security_and_trust",
      "limitations": "Requires an authorized semantic or runtime assessment appropriate to this category",
      "method": "Not performed by deterministic Scan Core state construction",
      "next_step": "Perform this check using an authorized analyzer and attach evidence",
      "reason": "Deterministic Scan Core does not perform this semantic or runtime assessment",
      "related_ids": [],
      "result": "No assessment result is available",
      "scope": "Declared local project scope",
      "status": "not_assessed",
      "title": "security and trust",
      "verification_state": "unverified"
    },
    {
      "artifact_ids": [],
      "category": "privacy_and_data_lifecycle",
      "evidence_ids": [],
      "id": "check-privacy_and_data_lifecycle",
      "limitations": "Requires an authorized semantic or runtime assessment appropriate to this category",
      "method": "Not performed by deterministic Scan Core state construction",
      "next_step": "Perform this check using an authorized analyzer and attach evidence",
      "reason": "Deterministic Scan Core does not perform this semantic or runtime assessment",
      "related_ids": [],
      "result": "No assessment result is available",
      "scope": "Declared local project scope",
      "status": "not_assessed",
      "title": "privacy and data lifecycle",
      "verification_state": "unverified"
    },
    {
      "artifact_ids": [],
      "category": "dependencies_and_licensing",
      "evidence_ids": [],
      "id": "check-dependencies_and_licensing",
      "limitations": "Requires an authorized semantic or runtime assessment appropriate to this category",
      "method": "Not performed by deterministic Scan Core state construction",
      "next_step": "Perform this check using an authorized analyzer and attach evidence",
      "reason": "Deterministic Scan Core does not perform this semantic or runtime assessment",
      "related_ids": [],
      "result": "No assessment result is available",
      "scope": "Declared local project scope",
      "status": "not_assessed",
      "title": "dependencies and licensing",
      "verification_state": "unverified"
    },
    {
      "artifact_ids": [],
      "category": "testing_and_reliability",
      "evidence_ids": [],
      "id": "check-testing_and_reliability",
      "limitations": "Requires an authorized semantic or runtime assessment appropriate to this category",
      "method": "Not performed by deterministic Scan Core state construction",
      "next_step": "Perform this check using an authorized analyzer and attach evidence",
      "reason": "Deterministic Scan Core does not perform this semantic or runtime assessment",
      "related_ids": [],
      "result": "No assessment result is available",
      "scope": "Declared local project scope",
      "status": "not_assessed",
      "title": "testing and reliability",
      "verification_state": "unverified"
    },
    {
      "artifact_ids": [],
      "category": "performance_and_resources",
      "evidence_ids": [],
      "id": "check-performance_and_resources",
      "limitations": "Requires an authorized semantic or runtime assessment appropriate to this category",
      "method": "Not performed by deterministic Scan Core state construction",
      "next_step": "Perform this check using an authorized analyzer and attach evidence",
      "reason": "Deterministic Scan Core does not perform this semantic or runtime assessment",
      "related_ids": [],
      "result": "No assessment result is available",
      "scope": "Declared local project scope",
      "status": "not_assessed",
      "title": "performance and resources",
      "verification_state": "unverified"
    },
    {
      "artifact_ids": [],
      "category": "maintainability",
      "evidence_ids": [],
      "id": "check-maintainability",
      "limitations": "Requires an authorized semantic or runtime assessment appropriate to this category",
      "method": "Not performed by deterministic Scan Core state construction",
      "next_step": "Perform this check using an authorized analyzer and attach evidence",
      "reason": "Deterministic Scan Core does not perform this semantic or runtime assessment",
      "related_ids": [],
      "result": "No assessment result is available",
      "scope": "Declared local project scope",
      "status": "not_assessed",
      "title": "maintainability",
      "verification_state": "unverified"
    },
    {
      "artifact_ids": [],
      "category": "usability_and_accessibility",
      "evidence_ids": [],
      "id": "check-usability_and_accessibility",
      "limitations": "Requires an authorized semantic or runtime assessment appropriate to this category",
      "method": "Not performed by deterministic Scan Core state construction",
      "next_step": "Perform this check using an authorized analyzer and attach evidence",
      "reason": "Deterministic Scan Core does not perform this semantic or runtime assessment",
      "related_ids": [],
      "result": "No assessment result is available",
      "scope": "Declared local project scope",
      "status": "not_assessed",
      "title": "usability and accessibility",
      "verification_state": "unverified"
    },
    {
      "artifact_ids": [],
      "category": "operations_and_recovery",
      "evidence_ids": [],
      "id": "check-operations_and_recovery",
      "limitations": "Requires an authorized semantic or runtime assessment appropriate to this category",
      "method": "Not performed by deterministic Scan Core state construction",
      "next_step": "Perform this check using an authorized analyzer and attach evidence",